<?xml version="1.0" encoding="UTF-8" standalone="no" ?>
<!-- <!DOCTYPE todo SYSTEM "todo.dtd"> -->
<!-- A Todo List -->
<todo xmlns="http://abbeyworkshop.com/todo"
		xmlns:xsi="http://www.w3.org/2001/XMLSchema-instance"
		xsi:schemaLocation="http://abbeyworkshop.com/todo todo.xsd"
>
	<list name="List1">
		<item>Item 1</item>
		<item>Item 2</item>
		<item>Item 3</item>
	</list>
	<list name="List2">
		<item>Item one</item>
		<item>Item two</item>
		<item>Item three</item>
	</list>
</todo>
